{"case_id":"EQ-F07-AH-04","content_digest":"85b9c03793cc8d8a2c8c2075de24c994d12ec52b0795a0614edff63cf417e4fd","current_rationale":"The frozen evaluator assessed compare the retained acceptance artifact for EQ-F07-AH-04.","current_verdict":"UNDETERMINED","defect_family":"rare valid environment condition","deterministic_score":35,"difficulty":"easy","evaluator_verdicts":["UNDETERMINED","UNDETERMINED","UNDETERMINED"],"primary_confidence":48,"provenance_digest":"6eb64c788377faa1119bcce81fc29c04ae26132ad6edab8ca2f96c5d4eae5dd1","rubric_clauses":[{"clause_id":"R1","schema_version":"1.0","text":"Complete the stated task."},{"clause_id":"R2","schema_version":"1.0","text":"Keep evidence isolated to this case."},{"clause_id":"R3","schema_version":"1.0","text":"Use UNDETERMINED when evidence is insufficient."}],"schema_version":"1.0","signal_profile":"baseline_visible","split":"AH","trajectory_events":[{"case_id":"EQ-F07-AH-04","content":"EQ-F07-AH-04: compare the retained acceptance artifact for the rare valid environment condition defect family.","event_id":"E1","event_type":"task_instruction","schema_version":"1.0"},{"case_id":"EQ-F07-AH-04","content":"EQ-F07-AH-04: The retained artifact contains the decisive acceptance evidence. The record is available for current Verdict assessment.","event_id":"E2","event_type":"tool_result","schema_version":"1.0"},{"case_id":"EQ-F07-AH-04","content":"Frozen artifact records the result of compare the retained acceptance artifact.","event_id":"E3","event_type":"artifact","schema_version":"1.0"}]}
