{"case_id":"EQ-F05-PCH-01","content_digest":"5cb3ec98faf08b6ea3b651b3ad26e4aa25d3c7b3f7186bd8767c024a1d23c955","current_rationale":"The frozen evaluator assessed inspect the untouched calibration holdout for EQ-F05-PCH-01.","current_verdict":"FAIL","defect_family":"stale instruction use","deterministic_score":55,"difficulty":"medium","evaluator_verdicts":["FAIL","PASS","UNDETERMINED"],"primary_confidence":61,"provenance_digest":"fd95c17759ee683e61503e90937ce235d7972737bc3026d2d1347e634e51718b","rubric_clauses":[{"clause_id":"R1","schema_version":"1.0","text":"Complete the stated task."},{"clause_id":"R2","schema_version":"1.0","text":"Keep evidence isolated to this case."},{"clause_id":"R3","schema_version":"1.0","text":"Use UNDETERMINED when evidence is insufficient."}],"schema_version":"1.0","signal_profile":"signal_conflicted","split":"PCH","trajectory_events":[{"case_id":"EQ-F05-PCH-01","content":"EQ-F05-PCH-01: inspect the untouched calibration holdout for the stale instruction use defect family.","event_id":"E1","event_type":"task_instruction","schema_version":"1.0"},{"case_id":"EQ-F05-PCH-01","content":"EQ-F05-PCH-01: The holdout record contains the decisive post-calibration evidence. The record is available for current Verdict assessment.","event_id":"E2","event_type":"tool_result","schema_version":"1.0"},{"case_id":"EQ-F05-PCH-01","content":"Frozen artifact records the result of inspect the untouched calibration holdout.","event_id":"E3","event_type":"artifact","schema_version":"1.0"}]}
