{"case_id":"EQ-F05-AH-03","content_digest":"27715171817f16228f387c88c736b6dd395b17509d0bf3f208962ce980ce8952","current_rationale":"The frozen evaluator assessed replay the isolated integration check for EQ-F05-AH-03.","current_verdict":"FAIL","defect_family":"stale instruction use","deterministic_score":55,"difficulty":"medium","evaluator_verdicts":["FAIL","PASS","UNDETERMINED"],"primary_confidence":61,"provenance_digest":"dc67bd99982a07d3f927dc2e4357a8553f8f4d5db58c04d2531a7e4edec71069","rubric_clauses":[{"clause_id":"R1","schema_version":"1.0","text":"Complete the stated task."},{"clause_id":"R2","schema_version":"1.0","text":"Keep evidence isolated to this case."},{"clause_id":"R3","schema_version":"1.0","text":"Use UNDETERMINED when evidence is insufficient."}],"schema_version":"1.0","signal_profile":"signal_conflicted","split":"AH","trajectory_events":[{"case_id":"EQ-F05-AH-03","content":"EQ-F05-AH-03: replay the isolated integration check for the stale instruction use defect family.","event_id":"E1","event_type":"task_instruction","schema_version":"1.0"},{"case_id":"EQ-F05-AH-03","content":"EQ-F05-AH-03: The replay output contains the decisive observed result. The record is available for current Verdict assessment.","event_id":"E2","event_type":"tool_result","schema_version":"1.0"},{"case_id":"EQ-F05-AH-03","content":"Frozen artifact records the result of replay the isolated integration check.","event_id":"E3","event_type":"artifact","schema_version":"1.0"}]}
